{
  "$schema": "http://json-schema.org/draft-07/schema#",
  "$id": "https://niovlabs.com/foundation/workflow-recommendation/recommendation.schema.json",
  "title": "NIOV Foundation Section 9 W3 Workflow Recommendation Substrate Schema",
  "description": "Validation schema for W3 Workflow Recommendation Substrate at docs/workflow-recommendation/. Each file is a wrapper containing kind + catalog_version + envelope_defaults + items[] of WorkflowRecommendation entries. Each item composes against an existing OOTB workflow ID (docs/ootb-catalog/workflows.json) + ADR-0081 Stage 1-2 maturity surface. STATIC RECOMMENDATION SUBSTRATE ONLY — every workflow_state is RECOMMENDATION_ONLY. Per ADR-0081 §2.2: Stage 1 (Template-only) + Stage 2 (Recommendation-only) cannot execute; Stage 3+ requires separate Founder authorization per slice + ADR-0057 + ADR-0026 dual-control where required.",
  "type": "object",
  "required": ["kind", "catalog_version", "envelope_defaults", "plan_archetype_id", "items"],
  "additionalProperties": false,
  "properties": {
    "$schema": { "type": "string" },
    "envelope_defaults": { "$ref": "#/definitions/EnvelopeDefaults" },
    "kind": { "type": "string", "enum": ["WorkflowRecommendationCatalog"] },
    "catalog_version": { "type": "string", "pattern": "^[0-9]+\\.[0-9]+\\.[0-9]+$" },
    "plan_archetype_id": { "type": "string", "enum": ["starter-pilot", "team", "business", "enterprise"] },
    "items": {
      "type": "array",
      "minItems": 1,
      "items": { "$ref": "#/definitions/WorkflowRecommendation" }
    }
  },
  "definitions": {
    "WorkflowRecommendation": {
      "type": "object",
      "required": [
        "id",
        "version",
        "status",
        "object_type",
        "name",
        "human_readable_summary",
        "model_usage_notes",
        "source_adr_refs",
        "consumes_workflow_template_id",
        "adr_0081_stage",
        "recommendation_purpose",
        "role_audience",
        "tool_dependencies",
        "safe_fallback",
        "dual_control_required_at_stage_3",
        "DMW_scope_implications",
        "governance_review_points",
        "audit_expectations",
        "safe_defaults",
        "forbidden_defaults",
        "allowed_consumers",
        "forbidden_consumers",
        "workflow_state"
      ],
      "properties": {
        "id": { "type": "string", "pattern": "^[a-z][a-zA-Z0-9_-]*(\\.[a-zA-Z0-9][a-zA-Z0-9_-]*)+\\.v[0-9]+$" },
        "version": { "type": "string", "pattern": "^[0-9]+$" },
        "status": { "type": "string", "enum": ["ACCEPTED", "PROPOSED", "DEPRECATED"] },
        "object_type": { "type": "string", "const": "WorkflowRecommendation" },
        "name": { "type": "string", "minLength": 1 },
        "human_readable_summary": { "type": "string", "minLength": 1 },
        "model_usage_notes": { "type": "string", "minLength": 1 },
        "source_adr_refs": {
          "type": "array",
          "minItems": 1,
          "items": { "type": "string", "pattern": "^(ADR-[0-9]{4}|RULE [0-9]+|US [0-9,]+)$" }
        },
        "consumes_workflow_template_id": { "type": "string", "pattern": "^workflow\\.[a-z][a-zA-Z0-9_-]*(\\.[a-zA-Z0-9][a-zA-Z0-9_-]*)*\\.v[0-9]+$" },
        "adr_0081_stage": { "type": "integer", "enum": [1, 2] },
        "recommendation_purpose": { "type": "string", "minLength": 1 },
        "role_audience": { "type": "array", "items": { "type": "string" }, "minItems": 1 },
        "tool_dependencies": { "type": "array", "items": { "type": "string" } },
        "safe_fallback": { "type": "string", "minLength": 1 },
        "dual_control_required_at_stage_3": { "type": "boolean" },
        "DMW_scope_implications": { "type": "array", "items": { "type": "string" }, "minItems": 1 },
        "governance_review_points": { "type": "array", "items": { "type": "string" }, "minItems": 1 },
        "audit_expectations": { "type": "array", "items": { "type": "string" }, "minItems": 1 },
        "safe_defaults": { "type": "array", "items": { "type": "string" } },
        "forbidden_defaults": { "type": "array", "items": { "type": "string" } },
        "allowed_consumers": { "type": "array", "items": { "type": "string" } },
        "forbidden_consumers": { "type": "array", "items": { "type": "string" } },
        "workflow_state": { "type": "string", "const": "RECOMMENDATION_ONLY" }
      },
      "additionalProperties": true
    },
    "EnvelopeDefaults": {
      "type": "object",
      "required": ["object_type", "human_readable_summary", "model_usage_notes", "scope_defaults", "permission_defaults", "provenance", "audit_expectations", "policy_purpose", "allowed_consumers", "forbidden_consumers", "sensitivity_level"],
      "additionalProperties": true,
      "properties": {
        "object_type": { "type": "string" },
        "human_readable_summary": { "type": "string" },
        "model_usage_notes": { "type": "string" },
        "scope_defaults": { "type": "array", "items": { "type": "string" } },
        "permission_defaults": { "type": "array", "items": { "type": "string" } },
        "provenance": {
          "type": "object",
          "required": ["authored_by", "source", "version_tag", "captured_at", "authority"]
        },
        "audit_expectations": { "type": "array", "items": { "type": "string" } },
        "policy_purpose": { "type": "string" },
        "allowed_consumers": { "type": "array", "items": { "type": "string" } },
        "forbidden_consumers": { "type": "array", "items": { "type": "string" } },
        "sensitivity_level": { "type": "string", "enum": ["LOW", "MEDIUM", "HIGH", "CRITICAL"] }
      }
    }
  }
}
