{
  "$schema": "./recommendation.schema.json",
  "kind": "WorkflowRecommendationCatalog",
  "catalog_version": "1.0.0",
  "plan_archetype_id": "starter-pilot",
  "envelope_defaults": {
    "object_type": "WorkflowRecommendation",
    "human_readable_summary": "Workflows at Stage 1 (Template-only) and Stage 2 (Recommendation-only) cannot execute. Workflow recommendations are advisory — Stage 3+ requires explicit Founder authorization per ADR-0081.",
    "model_usage_notes": "Starter / Pilot envelope keeps workflows at Stage 1 only — template education + Dandelion recommendation without surfacing them via Stage 2 to Twins yet. Stage 2+ deferred until Team plan or explicit pilot extension.",
    "scope_defaults": ["TENANT_SCOPED", "RECOMMENDATION_SCOPED", "ADMIN_VISIBLE_ONLY"],
    "permission_defaults": ["READ_FIRST", "NO_EXECUTION", "NO_CONNECTOR_INVOCATION"],
    "provenance": {
      "authored_by": "NIOV Labs / niov-foundation",
      "source": "docs/workflow-recommendation/starter-pilot-workflows.json",
      "version_tag": "w3-v1.0.0",
      "captured_at": "2026-06-01",
      "authority": "[FOUNDATION-W3-WORKFLOW-RECOMMENDATION]"
    },
    "audit_expectations": ["ADMIN_ACTION:WORKFLOW_RECOMMENDATION_REFERENCED when consumed"],
    "policy_purpose": "RECOMMENDATION_REFERENCE_ONLY",
    "allowed_consumers": ["DANDELION_RECOMMENDATION_ENGINE", "ADMIN_TWIN_SCOPED_TO_ORG", "CONTROL_TOWER_ADMIN_REVIEW", "FOUNDATION_GOVERNANCE_TIER"],
    "forbidden_consumers": ["AGENT_TWIN_CROSS_TENANT", "AGENT_TWIN_AUTONOMOUS_EXECUTION", "MANAGER_SURVEILLANCE_TOOL", "EMPLOYEE_SCORING_TOOL", "EXTERNAL_THIRD_PARTY_UNAUTHORIZED"],
    "sensitivity_level": "MEDIUM"
  },
  "items": [
    {
      "id": "recommendation.onboarding-checklist.starter-pilot.v1",
      "version": "1",
      "status": "ACCEPTED",
      "object_type": "WorkflowRecommendation",
      "name": "Onboarding Checklist (Stage 1 only)",
      "human_readable_summary": "Admin-visible template for pilot user onboarding. Stage 1 only at Starter / Pilot tier — Twin does not yet surface this as a recommendation.",
      "model_usage_notes": "Useful for Dandelion + Admin to walk the OOTB onboarding template during pilot setup. Stage 2 recommendation surface deferred to Team plan.",
      "source_adr_refs": ["ADR-0081", "ADR-0080", "ADR-0083", "RULE 0"],
      "consumes_workflow_template_id": "workflow.onboarding-checklist.v1",
      "adr_0081_stage": 1,
      "recommendation_purpose": "Establish a known good baseline for new-user onboarding within the pilot.",
      "role_audience": ["Otzar Administrator"],
      "tool_dependencies": [],
      "safe_fallback": "Admin walks the OOTB onboarding template manually without Twin assistance.",
      "dual_control_required_at_stage_3": false,
      "DMW_scope_implications": ["Operates within tenant + admin scope; no employee scope read"],
      "governance_review_points": ["Admin policy approval required before promoting to Stage 2 at a higher plan tier"],
      "audit_expectations": ["ADMIN_ACTION:WORKFLOW_RECOMMENDATION_REFERENCED when consumed by Admin"],
      "safe_defaults": ["Template-only access", "Read-only", "Admin-visible only"],
      "forbidden_defaults": ["Auto-execution", "Connector invocation", "Cross-tenant template fusion"],
      "allowed_consumers": ["DANDELION_RECOMMENDATION_ENGINE", "ADMIN_TWIN_SCOPED_TO_ORG", "CONTROL_TOWER_ADMIN_REVIEW", "FOUNDATION_GOVERNANCE_TIER"],
      "forbidden_consumers": ["AGENT_TWIN_CROSS_TENANT", "AGENT_TWIN_AUTONOMOUS_EXECUTION", "MANAGER_SURVEILLANCE_TOOL", "EMPLOYEE_SCORING_TOOL", "EXTERNAL_THIRD_PARTY_UNAUTHORIZED"],
      "workflow_state": "RECOMMENDATION_ONLY"
    },
    {
      "id": "recommendation.tomorrows-executive-brief.starter-pilot.v1",
      "version": "1",
      "status": "ACCEPTED",
      "object_type": "WorkflowRecommendation",
      "name": "Tomorrow's Executive Brief (Stage 1 only)",
      "human_readable_summary": "Admin-visible template surfacing a daily briefing structure. Stage 1 only at Starter / Pilot — the actual brief generation defers to Team plan + connector activation.",
      "model_usage_notes": "Template educates the pilot admin on the EA aha-moment shape per Wave 2.1 §22. No surfacing to non-admin Twins at this tier.",
      "source_adr_refs": ["ADR-0081", "ADR-0080", "ADR-0083", "RULE 0"],
      "consumes_workflow_template_id": "workflow.tomorrows-executive-brief.v1",
      "adr_0081_stage": 1,
      "recommendation_purpose": "Educate admin about EA daily-brief structure before broader rollout.",
      "role_audience": ["Otzar Administrator"],
      "tool_dependencies": [],
      "safe_fallback": "Admin reviews the OOTB template independently.",
      "dual_control_required_at_stage_3": false,
      "DMW_scope_implications": ["Template-only; no executive memory scope read at this tier"],
      "governance_review_points": ["Stage 2+ promotion requires Team plan + admin policy approval"],
      "audit_expectations": ["ADMIN_ACTION:WORKFLOW_RECOMMENDATION_REFERENCED when consumed"],
      "safe_defaults": ["Template-only access", "Read-only"],
      "forbidden_defaults": ["Auto-execution", "Connector invocation", "Executive-scope read at this tier"],
      "allowed_consumers": ["DANDELION_RECOMMENDATION_ENGINE", "ADMIN_TWIN_SCOPED_TO_ORG", "CONTROL_TOWER_ADMIN_REVIEW", "FOUNDATION_GOVERNANCE_TIER"],
      "forbidden_consumers": ["AGENT_TWIN_CROSS_TENANT", "AGENT_TWIN_AUTONOMOUS_EXECUTION", "MANAGER_SURVEILLANCE_TOOL", "EMPLOYEE_SCORING_TOOL", "EXTERNAL_THIRD_PARTY_UNAUTHORIZED"],
      "workflow_state": "RECOMMENDATION_ONLY"
    },
    {
      "id": "recommendation.offboarding-checklist.starter-pilot.v1",
      "version": "1",
      "status": "ACCEPTED",
      "object_type": "WorkflowRecommendation",
      "name": "Offboarding Checklist (Stage 1 only)",
      "human_readable_summary": "Admin-visible template for pilot user offboarding. Stage 1 only at Starter / Pilot tier.",
      "model_usage_notes": "Useful for evaluation deployments to ensure clean offboarding without losing audit history per RULE 10 + ADR-0002.",
      "source_adr_refs": ["ADR-0081", "ADR-0080", "ADR-0083", "ADR-0002", "RULE 0", "RULE 10"],
      "consumes_workflow_template_id": "workflow.offboarding-checklist.v1",
      "adr_0081_stage": 1,
      "recommendation_purpose": "Preserve audit + DMW safety during pilot user offboarding.",
      "role_audience": ["Otzar Administrator"],
      "tool_dependencies": [],
      "safe_fallback": "Admin walks offboarding manually; audit chain integrity preserved per ADR-0002.",
      "dual_control_required_at_stage_3": false,
      "DMW_scope_implications": ["Offboarding preserves audit history; DMW soft-delete only per RULE 10"],
      "governance_review_points": ["Audit history preserved regardless of plan tier", "DMW safety preserved through offboarding"],
      "audit_expectations": ["ADMIN_ACTION:WORKFLOW_RECOMMENDATION_REFERENCED when consumed", "audit chain integrity per ADR-0002"],
      "safe_defaults": ["Template-only access", "Audit-preserving offboarding"],
      "forbidden_defaults": ["Audit history deletion", "DMW hard-delete", "Connector invocation"],
      "allowed_consumers": ["DANDELION_RECOMMENDATION_ENGINE", "ADMIN_TWIN_SCOPED_TO_ORG", "CONTROL_TOWER_ADMIN_REVIEW", "FOUNDATION_GOVERNANCE_TIER"],
      "forbidden_consumers": ["AGENT_TWIN_CROSS_TENANT", "AGENT_TWIN_AUTONOMOUS_EXECUTION", "MANAGER_SURVEILLANCE_TOOL", "EMPLOYEE_SCORING_TOOL", "EXTERNAL_THIRD_PARTY_UNAUTHORIZED"],
      "workflow_state": "RECOMMENDATION_ONLY"
    }
  ]
}
